{
  "format": "narrative-canvas-state-schema",
  "version": 1,
  "exportedAt": "2026-06-12T00:00:00.000Z",
  "source": {
    "title": "Story Source Acceptance Play",
    "notes": ""
  },
  "summary": {
    "variableCount": 1,
    "issueCount": 0,
    "readCount": 0,
    "writeCount": 0,
    "interpolationCount": 0,
    "exportBlockCount": 0,
    "invalidExpressionCount": 0
  },
  "variables": [
    {
      "key": "route",
      "exportKey": "route",
      "type": "string",
      "hasInitial": true,
      "initialValue": "",
      "statuses": ["ok"],
      "primaryStatus": "ok",
      "readBy": [],
      "writtenBy": [],
      "interpolatedBy": []
    }
  ],
  "invalidExpressions": [],
  "exportBlocks": []
}
